{
  "$schema": "https://json-schema.org/draft/2020-12/schema",
  "$id": "https://open-ai-curriculum.local/domains/science/g5/learner-state.schema.json",
  "title": "G5 Learner State",
  "type": "object",
  "required": [
    "learner_id",
    "node_id",
    "status",
    "dependency_status",
    "direct_accuracy",
    "explanation_status",
    "transfer_status",
    "retention_status",
    "dominant_failure_modes",
    "recommended_interventions",
    "last_verified_at",
    "review_state"
  ],
  "properties": {
    "learner_id": {
      "type": "string",
      "minLength": 1
    },
    "node_id": {
      "const": "G5"
    },
    "status": {
      "enum": [
        "blocked",
        "emerging",
        "provisional",
        "secure",
        "unstable"
      ]
    },
    "dependency_status": {
      "type": "object",
      "required": [
        "T5",
        "L4",
        "E4",
        "D4"
      ],
      "properties": {
        "T5": {
          "enum": [
            "secure",
            "unstable",
            "blocked"
          ]
        },
        "L4": {
          "enum": [
            "secure",
            "unstable",
            "blocked"
          ]
        },
        "E4": {
          "enum": [
            "secure",
            "unstable",
            "blocked"
          ]
        },
        "D4": {
          "enum": [
            "secure",
            "unstable",
            "blocked"
          ]
        }
      },
      "additionalProperties": false
    },
    "direct_accuracy": {
      "type": "number",
      "minimum": 0,
      "maximum": 1
    },
    "explanation_status": {
      "enum": [
        "not_met",
        "weak",
        "met"
      ]
    },
    "transfer_status": {
      "enum": [
        "not_met",
        "weak",
        "met"
      ]
    },
    "retention_status": {
      "enum": [
        "not_due",
        "not_met",
        "met"
      ]
    },
    "dominant_failure_modes": {
      "type": "array",
      "items": {
        "enum": [
          "G5-FM-01",
          "G5-FM-02",
          "G5-FM-03",
          "G5-FM-04"
        ]
      },
      "uniqueItems": true
    },
    "recommended_interventions": {
      "type": "array",
      "items": {
        "type": "string",
        "minLength": 1
      }
    },
    "last_verified_at": {
      "type": "string",
      "pattern": "^[0-9]{4}-[0-9]{2}-[0-9]{2}$"
    },
    "review_state": {
      "enum": [
        "draft",
        "human-reviewed"
      ]
    },
    "notes": {
      "type": "string"
    }
  },
  "additionalProperties": false
}
